{
  "versao": 1,
  "id": "geral",
  "revisao": 1,
  "nome": "Geral",
  "descricao": "Ler qualquer texto pelo que ele afirma, pelos conceitos que pressupõe, pelas razões que oferece, pelos exemplos, objeções e consequências. É o modo de quando o tipo é outro ou não se sabe; não força tese em texto que só narra, informa ou instrui.",
  "funcoes": [
    {
      "chave": "tese",
      "rotulo": "Tese",
      "pergunta": "O que o autor está afirmando ou demonstrando?",
      "descricao": "Proposição principal ou conclusão de uma seção. Ex.: “A cidade cresceu porque o porto atraiu comércio.”",
      "cor": {
        "claro": "#FFD926",
        "escuro": "#FFD926"
      }
    },
    {
      "chave": "conceito",
      "rotulo": "Conceito",
      "pergunta": "O que preciso entender ou assumir para acompanhar o trecho?",
      "descricao": "Definição, distinção ou pressuposto. Ex.: “Por cidade entendo aqui o núcleo urbano murado.”",
      "cor": {
        "claro": "#59D675",
        "escuro": "#59D675"
      }
    },
    {
      "chave": "justificativa",
      "rotulo": "Justificativa",
      "pergunta": "Por que o autor afirma isso? Com que razão ou evidência?",
      "descricao": "Razão, dado ou argumento que sustenta uma afirmação. Ex.: “Os registros do porto triplicaram em dez anos.”",
      "cor": {
        "claro": "#52ABFF",
        "escuro": "#52ABFF"
      }
    },
    {
      "chave": "exemplo",
      "rotulo": "Exemplo",
      "pergunta": "Que caso concreto ilustra a ideia?",
      "descricao": "Caso, cena ou dado que ilustra, sem provar. Ex.: “Veja-se o caso de Veneza.”",
      "cor": {
        "claro": "#B98CFF",
        "escuro": "#B98CFF"
      }
    },
    {
      "chave": "objecao",
      "rotulo": "Objeção",
      "pergunta": "Que posição contrária ou dificuldade é considerada?",
      "descricao": "Objeção, contraponto ou limite reconhecido. Ex.: “Pode-se objetar que outras cidades cresceram sem porto.”",
      "cor": {
        "claro": "#FF8A3D",
        "escuro": "#FF8A3D"
      }
    },
    {
      "chave": "consequencia",
      "rotulo": "Consequência",
      "pergunta": "O que se segue disso?",
      "descricao": "Implicação, efeito ou proposta decorrente. Ex.: “Daí a importância de manter o porto aberto.”",
      "cor": {
        "claro": "#2EC4B6",
        "escuro": "#2EC4B6"
      }
    }
  ],
  "comentarios": [
    "AUTOR",
    "LEITURA",
    "INVESTIGAR",
    "OBJECAO",
    "CONEXAO"
  ],
  "saliencia": {
    "alvo_por_nivel": {
      "1": 0.04,
      "2": 0.1,
      "3": 0.2
    }
  }
}
