{
  "versao": 1,
  "id": "Teste Modo",
  "revisao": 1,
  "nome": "Teste",
  "descricao": "Modo mínimo de teste.",
  "funcoes": [
    {
      "chave": "tese",
      "rotulo": "Tese",
      "pergunta": "O que o trecho diz sobre tese?",
      "descricao": "Trechos de tese.",
      "cor": {
        "claro": "#FFD926",
        "escuro": "#FFD926"
      }
    },
    {
      "chave": "conceito",
      "rotulo": "Conceito",
      "pergunta": "O que o trecho diz sobre conceito?",
      "descricao": "Trechos de conceito.",
      "cor": {
        "claro": "#59D675",
        "escuro": "#59D675"
      }
    }
  ],
  "comentarios": [
    "LEITURA"
  ],
  "saliencia": {
    "alvo_por_nivel": {
      "1": 0.05,
      "2": 0.1,
      "3": 0.2
    }
  }
}
