{
  "versao": 1,
  "id": "escritura",
  "revisao": 1,
  "nome": "Escritura e exegese",
  "descricao": "Ler a Escritura e seus comentários distinguindo o que o texto narra, a palavra dita (de Deus, do profeta, de uma personagem), as imagens que carregam o sentido, os ecos de outras passagens, o ensino e a resposta pedida a quem lê. O sentido literal vem antes do espiritual; a leitura posterior se atribui à tradição que a faz.",
  "funcoes": [
    {
      "chave": "narrativa",
      "rotulo": "Narrativa",
      "pergunta": "Que acontecimento ou gesto a passagem relata?",
      "descricao": "Ação, cena ou episódio narrado, com seu estatuto: acontecido, visto em sonho, contado em parábola. Ex.: “Jesus tomou o pão, deu graças e o partiu.”",
      "cor": {
        "claro": "#FFD926",
        "escuro": "#FFD926"
      }
    },
    {
      "chave": "palavra",
      "rotulo": "Palavra e promessa",
      "pergunta": "Que palavra, mandamento ou promessa é dita, e por quem?",
      "descricao": "Fala de Deus, do profeta, de Jesus ou de uma personagem, atribuída. Ex.: “Eu estarei convosco todos os dias.”",
      "cor": {
        "claro": "#59D675",
        "escuro": "#59D675"
      }
    },
    {
      "chave": "imagem",
      "rotulo": "Imagem e símbolo",
      "pergunta": "Que imagem ou símbolo carrega o sentido da passagem?",
      "descricao": "Figura, comparação ou símbolo que organiza a leitura. Ex.: “Eu sou a videira, vós os ramos.”",
      "cor": {
        "claro": "#52ABFF",
        "escuro": "#52ABFF"
      }
    },
    {
      "chave": "eco",
      "rotulo": "Eco de outra passagem",
      "pergunta": "Que outra passagem da Escritura esta retoma, cita ou cumpre?",
      "descricao": "Citação, alusão ou cumprimento explícito no texto recebido. Ex.: “para que se cumprisse o que foi dito pelo profeta”.",
      "cor": {
        "claro": "#B98CFF",
        "escuro": "#B98CFF"
      }
    },
    {
      "chave": "ensino",
      "rotulo": "Ensino",
      "pergunta": "Que verdade de fé ou de vida a passagem ensina?",
      "descricao": "Ensinamento formulado pelo texto ou pelo comentador, atribuído. Ex.: “Deus é amor.”",
      "cor": {
        "claro": "#FF8A3D",
        "escuro": "#FF8A3D"
      }
    },
    {
      "chave": "resposta",
      "rotulo": "Resposta pedida",
      "pergunta": "Que conversão, oração ou atitude a passagem pede de quem lê?",
      "descricao": "Exortação, convite ou mandamento dirigido ao leitor ou à comunidade. Ex.: “Vigiai e orai.”",
      "cor": {
        "claro": "#2EC4B6",
        "escuro": "#2EC4B6"
      }
    }
  ],
  "comentarios": [
    "AUTOR",
    "LEITURA",
    "INVESTIGAR",
    "CONEXAO",
    "TENSAO"
  ],
  "saliencia": {
    "alvo_por_nivel": {
      "1": 0.04,
      "2": 0.1,
      "3": 0.2
    }
  }
}
